URL,Version,Status,OIDs,Name,Title,Description,Used
http://dicom.nema.org/resources/ontology/DCM,01,active,"1.2.840.10008.2.16.4",DICOM Controlled Terminology Definitions,,"DICOM Code Definitions (Coding Scheme Designator ""DCM"" Coding Scheme Version ""01"")","ValueSet/participation-role-type,ValueSet/dicom-cid-7010-KeyObjectSelectionDocumentTitle,ValueSet/audit-event-type,ValueSet/dicom-cid-33-Modality"
http://hl7.org/fhir/CodeSystem/medication-statement-status,4.0.1,draft,"2.16.840.1.113883.4.642.4.1379",Medication Status Codes,Medication  status  codes,"Medication Status Codes","ValueSet/R5-medication-statement-status-for-R4"
http://hl7.org/fhir/CodeSystem/medicationrequest-status,4.0.1,draft,"2.16.840.1.113883.4.642.4.1377",medicationrequest Status,Medicationrequest  status,"MedicationRequest Status Codes","ValueSet/R5-medicationrequest-status-for-R4"
http://hl7.org/fhir/FHIR-version,4.0.1,active,"2.16.840.1.113883.4.642.4.1310",FHIRVersion,FHIRVersion,"All published FHIR Versions.","ValueSet/R5-FHIR-version-for-R4"
http://hl7.org/fhir/action-participant-type,4.0.1,draft,"2.16.840.1.113883.4.642.4.812",ActionParticipantType,ActionParticipantType,"The type of participant for the action.","ValueSet/R5-action-participant-type-for-R4"
http://hl7.org/fhir/appointmentstatus,4.0.1,draft,"2.16.840.1.113883.4.642.4.485",AppointmentStatus,AppointmentStatus,"The free/busy status of an appointment.","ValueSet/R5-appointmentresponse-status-for-R4"
http://hl7.org/fhir/assert-operator-codes,4.0.1,draft,"2.16.840.1.113883.4.642.4.709",AssertionOperatorType,AssertionOperatorType,"The type of operator to use for assertion.","ValueSet/R5-assert-operator-codes-for-R4"
http://hl7.org/fhir/assert-response-code-types,4.0.1,draft,"2.16.840.1.113883.4.642.4.711",AssertionResponseTypes,AssertionResponseTypes,"The type of response code to use for assertion.","ValueSet/R5-assert-response-code-types-for-R4"
http://hl7.org/fhir/audit-event-outcome,4.0.1,draft,"2.16.840.1.113883.4.642.4.455",AuditEventOutcome,AuditEventOutcome,"Indicates whether the event succeeded or failed.","ValueSet/audit-event-outcome"
http://hl7.org/fhir/bundle-type,4.0.1,active,"2.16.840.1.113883.4.642.4.621",BundleType,BundleType,"Indicates the purpose of a bundle - how it is intended to be used.","ValueSet/R5-bundle-type-for-R4"
http://hl7.org/fhir/code-search-support,4.0.1,draft,"2.16.840.1.113883.4.642.4.861",CodeSearchSupport,CodeSearchSupport,"The degree to which the server supports the code search parameter on ValueSet, if it is supported.","ValueSet/R5-code-search-support-for-R4"
http://hl7.org/fhir/compartment-type,4.0.1,draft,"2.16.840.1.113883.4.642.4.787",CompartmentType,CompartmentType,"Which type a compartment definition describes.","ValueSet/R5-compartment-type-for-R4"
http://hl7.org/fhir/composition-attestation-mode,4.0.1,draft,"2.16.840.1.113883.4.642.4.239",CompositionAttestationMode,CompositionAttestationMode,"The way in which a person authenticated a composition.","ValueSet/composition-attestation-mode"
http://hl7.org/fhir/composition-status,4.0.1,draft,"2.16.840.1.113883.4.642.4.242",CompositionStatus,CompositionStatus,"The workflow/clinical status of the composition.","ValueSet/R5-composition-status-for-R4"
http://hl7.org/fhir/conceptmap-unmapped-mode,4.0.1,draft,"2.16.840.1.113883.4.642.4.481",ConceptMapGroupUnmappedMode,ConceptMapGroupUnmappedMode,"Defines which action to take if there is no match in the group.","ValueSet/R5-conceptmap-unmapped-mode-for-R4"
http://hl7.org/fhir/consent-state-codes,4.0.1,draft,"2.16.840.1.113883.4.642.4.756",ConsentState,ConsentState,"Indicates the state of the consent.","ValueSet/R5-consent-state-codes-for-R4"
http://hl7.org/fhir/device-nametype,4.0.1,draft,"2.16.840.1.113883.4.642.4.1084",DeviceNameType,DeviceNameType,"The type of name the device is referred by.","ValueSet/R5-device-nametype-for-R4"
http://hl7.org/fhir/diagnostic-report-status,4.0.1,draft,"2.16.840.1.113883.4.642.4.236",DiagnosticReportStatus,DiagnosticReportStatus,"The status of the diagnostic report.","ValueSet/R5-diagnostic-report-status-for-R4"
http://hl7.org/fhir/discriminator-type,4.0.1,active,"2.16.840.1.113883.4.642.4.92",DiscriminatorType,DiscriminatorType,"How an element value is interpreted when discrimination is evaluated.","ValueSet/R5-discriminator-type-for-R4"
http://hl7.org/fhir/encounter-status,4.0.1,draft,"2.16.840.1.113883.4.642.4.247",EncounterStatus,EncounterStatus,"Current state of the encounter.","ValueSet/R5-encounter-status-for-R4"
http://hl7.org/fhir/event-status,4.0.1,draft,"2.16.840.1.113883.4.642.4.110",EventStatus,EventStatus,"Codes identifying the lifecycle stage of an event.","ValueSet/R5-adverse-event-status-for-R4"
http://hl7.org/fhir/event-timing,4.0.1,active,"2.16.840.1.113883.4.642.4.76",EventTiming,EventTiming,"Real world event relating to the schedule.","ValueSet/R5-event-timing-for-R4"
http://hl7.org/fhir/filter-operator,4.0.1,active,"2.16.840.1.113883.4.642.4.479",FilterOperator,FilterOperator,"The kind of operation to perform as a part of a property based filter.","ValueSet/R5-filter-operator-for-R4"
http://hl7.org/fhir/graph-compartment-use,4.0.1,draft,"2.16.840.1.113883.4.642.4.283",GraphCompartmentUse,GraphCompartmentUse,"Defines how a compartment rule is used.","ValueSet/R5-graph-compartment-use-for-R4"
http://hl7.org/fhir/group-type,4.0.1,draft,"2.16.840.1.113883.4.642.4.285",GroupType,GroupType,"Types of resources that are part of group.","ValueSet/R5-group-type-for-R4"
http://hl7.org/fhir/issue-severity,4.0.1,active,"2.16.840.1.113883.4.642.4.409",IssueSeverity,IssueSeverity,"How the issue affects the success of the action.","ValueSet/R5-issue-severity-for-R4"
http://hl7.org/fhir/issue-type,4.0.1,active,"2.16.840.1.113883.4.642.4.411",IssueType,IssueType,"A code that describes the type of issue.","ValueSet/R5-issue-type-for-R4"
http://hl7.org/fhir/item-type,4.0.1,draft,"2.16.840.1.113883.4.642.4.445",QuestionnaireItemType,QuestionnaireItemType,"Distinguishes groups from questions and display text and indicates data type for questions.","ValueSet/R5-item-type-for-R4"
http://hl7.org/fhir/namingsystem-identifier-type,4.0.1,draft,"2.16.840.1.113883.4.642.4.493",NamingSystemIdentifierType,NamingSystemIdentifierType,"Identifies the style of unique identifier used to identify a namespace.","ValueSet/R5-namingsystem-identifier-type-for-R4"
http://hl7.org/fhir/provenance-entity-role,4.0.1,draft,"2.16.840.1.113883.4.642.4.437",ProvenanceEntityRole,ProvenanceEntityRole,"How an entity was used in an activity.","ValueSet/R5-provenance-entity-role-for-R4"
http://hl7.org/fhir/publication-status,4.0.1,active,"2.16.840.1.113883.4.642.4.4",PublicationStatus,PublicationStatus,"The lifecycle status of an artifact.","ValueSet/R5-publication-status-for-R4"
http://hl7.org/fhir/quantity-comparator,4.0.1,active,"2.16.840.1.113883.4.642.4.60",QuantityComparator,QuantityComparator,"How the Quantity should be understood and represented.","ValueSet/R5-quantity-comparator-for-R4"
http://hl7.org/fhir/related-artifact-type,4.0.1,draft,"2.16.840.1.113883.4.642.4.100",RelatedArtifactType,RelatedArtifactType,"The type of relationship to the related artifact.","ValueSet/R5-related-artifact-type-all-for-R4,ValueSet/R5-related-artifact-type-for-R4"
http://hl7.org/fhir/request-intent,4.0.1,draft,"2.16.840.1.113883.4.642.4.114",RequestIntent,RequestIntent,"Codes indicating the degree of authority/intentionality associated with a request.","ValueSet/R5-transport-intent-for-R4,ValueSet/R5-care-plan-intent-for-R4"
http://hl7.org/fhir/research-study-status,4.0.1,draft,"2.16.840.1.113883.4.642.4.820",ResearchStudyStatus,ResearchStudyStatus,"Codes that convey the current status of the research study.","ValueSet/research-study-status"
http://hl7.org/fhir/resource-types,4.0.1,active,,ResourceType,ResourceType,"One of the resource types defined as part of this version of FHIR.","ValueSet/consent-content-class"
http://hl7.org/fhir/restful-interaction,4.0.1,active,,FHIR Restful Interactions,,"The set of interactions defined by the RESTful part of the FHIR specification.","ValueSet/R5-interaction-trigger-for-R4"
http://hl7.org/fhir/search-comparator,4.0.1,draft,"2.16.840.1.113883.4.642.4.638",SearchComparator,SearchComparator,"What Search Comparator Codes are supported in search.","ValueSet/R5-value-filter-comparator-for-R4"
http://hl7.org/fhir/search-modifier-code,4.0.1,draft,"2.16.840.1.113883.4.642.4.640",SearchModifierCode,SearchModifierCode,"A supported modifier for a search parameter.","ValueSet/R5-search-modifier-code-for-R4"
http://hl7.org/fhir/subscription-channel-type,4.0.1,draft,"2.16.840.1.113883.4.642.4.501",SubscriptionChannelType,SubscriptionChannelType,"The type of method used to execute a subscription.","ValueSet/subscription-channel-type"
http://hl7.org/fhir/subscription-status,4.0.1,draft,"2.16.840.1.113883.4.642.4.503",SubscriptionStatus,SubscriptionStatus,"The status of a subscription.","ValueSet/R5-subscription-status-for-R4"
http://hl7.org/fhir/udi-entry-type,4.0.1,draft,"2.16.840.1.113883.4.642.4.212",UDIEntryType,UDIEntryType,"Codes to identify how UDI data was entered.","ValueSet/R5-udi-entry-type-for-R4"
http://loinc.org,3.1.0,active,"2.16.840.1.113883.6.1",LOINC,Logical Observation Identifiers, Names and Codes (LOINC),"LOINC provides a set of universal names and ID codes for identifying laboratory and clinical test results.1,2 LOINC facilitates the exchange and pooling of results, such as blood hemoglobin, serum potassium, or vital signs, for clinical care, outcomes management, and research. LOINC's universal identifiers (names and codes) can be used in the context of order and observation exchanges between information systems that use syntax standards such as HL73, CEN TC251, ISO TC215, ASTM4, and DICOM. Specifically, the identifier can be used as the coded value for an observation in any other standard that uses the observation/observation value paradigm, whether messages, documents, application programming interface (API), etc. For example, LOINC codes are used widely in the OBX segment Observation Identifier field (OBX-3) of an ORU HL7 (HL7 version 2.x or ASTM 1238-9410) message that may be sent between a Clinical Laboratory Information Management Systems (LIMS) and Electronic Health Record Systems (EHR).5, 6 In this way, LOINC codes provide universal identifiers that allow the exchange of clinical data between heterogeneous computing environments.","ValueSet/observation-codes,ValueSet/consent-content-code,ValueSet/091388b0-d321-4598-b78b-d8733b9c723d"
http://snomed.info/sct,null,active,"2.16.840.1.113883.6.96",SNOMED_CT,SNOMED CT (all versions),"SNOMED CT is the most comprehensive and precise clinical health terminology product in the world, owned and distributed around the world by The International Health Terminology Standards Development Organisation (IHTSDO).","ValueSet/performer-role,ValueSet/c80-facilitycodes,ValueSet/device-type,ValueSet/clinical-findings,ValueSet/condition-stage,ValueSet/immunization-target-disease,ValueSet/referencerange-appliesto,ValueSet/c80-practice-codes,ValueSet/route-codes,ValueSet/procedure-category,ValueSet/dicom-cid-244-Laterality,ValueSet/bodystructure-relative-location,ValueSet/designation-use,ValueSet/medication-form-codes,ValueSet/medication-codes,ValueSet/body-site,ValueSet/questionnaire-answers,ValueSet/procedure-code,ValueSet/medication-as-needed-reason,ValueSet/reason-medication-status-codes,ValueSet/condition-severity"
http://terminology.hl7.org/CodeSystem/FDI-surface,1.0.0,draft,"2.16.840.1.113883.4.642.1.1154",SurfaceCodes,Surface Codes,"This value set includes a smattering of FDI tooth surface codes.","ValueSet/surface"
http://terminology.hl7.org/CodeSystem/adverse-event-causality-assess,1.0.1,active,"2.16.840.1.113883.4.642.1.1254",AdverseEventCausalityAssessment,AdverseEventCausalityAssessment,"Codes for the assessment of whether the entity caused the event.","ValueSet/adverse-event-causality-assess"
http://terminology.hl7.org/CodeSystem/allergyintolerance-verification,1.0.1,active,"2.16.840.1.113883.4.642.1.1371",AllergyIntoleranceVerificationStatus,AllergyIntolerance Verification Status,"The verification status to support or decline the clinical status of the allergy or intolerance.","ValueSet/R5-allergyintolerance-verification-for-R4"
http://terminology.hl7.org/CodeSystem/audit-event-type,1.0.0,active,"2.16.840.1.113883.4.642.1.1136",AuditEventID,Audit Event ID,"Event Types for Audit Events - defined by DICOM with some FHIR specific additions.","ValueSet/audit-event-type"
http://terminology.hl7.org/CodeSystem/benefit-network,1.0.1,active,"2.16.840.1.113883.4.642.1.1177",NetworkTypeCodes,Network Type Codes,"This value set includes a smattering of Network type codes.","ValueSet/benefit-network"
http://terminology.hl7.org/CodeSystem/benefit-term,1.0.1,active,"2.16.840.1.113883.4.642.1.1179",BenefitTermCodes,Benefit Term Codes,"This value set includes a smattering of Benefit Term codes.","ValueSet/benefit-term"
http://terminology.hl7.org/CodeSystem/benefit-unit,1.0.1,active,"2.16.840.1.113883.4.642.1.1178",UnitTypeCodes,Unit Type Codes,"This value set includes a smattering of Unit type codes.","ValueSet/benefit-unit"
http://terminology.hl7.org/CodeSystem/condition-clinical,3.0.0,active,"2.16.840.1.113883.4.642.1.1074",ConditionClinicalStatusCodes,Condition Clinical Status Codes,"Preferred value set for Condition Clinical Status.","ValueSet/R5-condition-clinical-for-R4"
http://terminology.hl7.org/CodeSystem/consentaction,1.0.1,active,"2.16.840.1.113883.4.642.1.1227",ConsentActionCodes,Consent Action Codes,"This value set includes sample Consent Action codes.","ValueSet/consent-action"
http://terminology.hl7.org/CodeSystem/consentpolicycodes,3.0.1,active,"2.16.840.1.113883.4.642.1.1229",ConsentPolicyRuleCodes,Consent PolicyRule Codes,"This value set includes sample Regulatory consent policy types from the US and other regions.","ValueSet/consent-policy"
http://terminology.hl7.org/CodeSystem/contactentity-type,1.0.0,draft,"2.16.840.1.113883.4.642.1.1129",ContactEntityType,Contact entity type,"This example value set defines a set of codes that can be used to indicate the purpose for which you would contact a contact party.","ValueSet/contactentity-type"
http://terminology.hl7.org/CodeSystem/contractsignertypecodes,1.0.1,active,"2.16.840.1.113883.4.642.1.1201",ContractSignerTypeCodes,Contract Signer Type Codes,"This value set includes sample Contract Signer Type codes.","ValueSet/participation-role-type"
http://terminology.hl7.org/CodeSystem/definition-topic,1.0.1,active,"2.16.840.1.113883.4.642.1.1244",DefinitionTopic,DefinitionTopic,"High-level categorization of the definition, used for searching, sorting, and filtering.","ValueSet/definition-topic"
http://terminology.hl7.org/CodeSystem/diet,1.0.1,active,"2.16.840.1.113883.4.642.1.1091",Diet,Diet,"This value set defines a set of codes that can be used to indicate dietary preferences or restrictions a patient may have.","ValueSet/encounter-diet"
http://terminology.hl7.org/CodeSystem/directness,2.0.0,draft,"2.16.840.1.113883.4.642.1.1459",EvidenceDirectness,EvidenceDirectness,"The quality of how direct the match is.","ValueSet/directness"
http://terminology.hl7.org/CodeSystem/encounter-special-arrangements,1.0.1,active,"2.16.840.1.113883.4.642.1.1090",SpecialArrangements,Special arrangements,"This value set defines a set of codes that can be used to indicate the kinds of special arrangements in place for a patients visit.","ValueSet/encounter-special-arrangements"
http://terminology.hl7.org/CodeSystem/encounter-type,1.0.1,active,"2.16.840.1.113883.4.642.1.1088",EncounterType,Encounter type,"This example value set defines a set of codes that can be used to indicate the type of encounter: a specific code indicating type of service provided.","ValueSet/encounter-type"
http://terminology.hl7.org/CodeSystem/endpoint-connection-type,2.1.1,active,"2.16.840.1.113883.4.642.1.1140",EndpointConnectionType,Endpoint Connection Type,"This is an example value set defined by the FHIR project, that could be used to represent possible connection type profile values.","ValueSet/endpoint-connection-type"
http://terminology.hl7.org/CodeSystem/endpoint-payload-type,2.0.1,active,"2.16.840.1.113883.4.642.1.1139",EndpointPayloadType,Endpoint Payload Type,"This is an example value set defined by the FHIR project, that could be used to represent possible payload document types.","ValueSet/endpoint-payload-type"
http://terminology.hl7.org/CodeSystem/ex-USCLS,1.0.0,draft,"2.16.840.1.113883.4.642.1.1153",USCLSCodes,USCLS Codes,"This value set includes a smattering of USCLS codes.","ValueSet/service-uscls"
http://terminology.hl7.org/CodeSystem/ex-benefitcategory,1.0.1,active,"2.16.840.1.113883.4.642.1.1175",BenefitCategoryCodes,Benefit Category Codes,"This value set includes examples of Benefit Category codes.","ValueSet/ex-benefitcategory"
http://terminology.hl7.org/CodeSystem/ex-diagnosisrelatedgroup,1.0.1,active,"2.16.840.1.113883.4.642.1.1166",ExampleDiagnosisRelatedGroupCodes,Example Diagnosis Related Group Codes,"This value set includes example Diagnosis Related Group codes.","ValueSet/ex-diagnosisrelatedgroup"
http://terminology.hl7.org/CodeSystem/ex-revenue-center,1.0.1,active,"2.16.840.1.113883.4.642.1.1168",ExampleRevenueCenterCodes,Example Revenue Center Codes,"This value set includes sample Revenue Center codes.","ValueSet/ex-revenue-center"
http://terminology.hl7.org/CodeSystem/extra-security-role-type,1.0.1,active,,SecurityRoleType,Security Role Type,"This CodeSystem contains Additional FHIR-defined Security Role types not defined elsewhere","ValueSet/participation-role-type"
http://terminology.hl7.org/CodeSystem/immunization-program-eligibility,1.0.1,active,"2.16.840.1.113883.4.642.1.1099",ImmunizationProgramEligibility,Immunization Program Eligibility,"The value set to instantiate this attribute should be drawn from a terminologically robust code system that consists of or contains concepts to support describing the patient's eligibility for a vaccination program. This value set is provided as a suggestive example.","ValueSet/immunization-program-eligibility"
http://terminology.hl7.org/CodeSystem/iso-21089-lifecycle,1.0.0,active,,Iso_21089_2017_Health_Record_Lifecycle_Events,ISO 21089 2017 Health Record Lifecycle Events,"Attached is vocabulary for the 27 record lifecycle events, as per ISO TS 21089-2017, Health Informatics - Trusted End-to-End Information Flows, Section 3, Terms and Definitions (2017, at ISO Central Secretariat, passed ballot and ready for publication).  This will also be included in the FHIR EHR Record Lifecycle Event Implementation Guide, balloted and (to be) published with FHIR STU-3.","ValueSet/audit-event-type"
http://terminology.hl7.org/CodeSystem/list-empty-reason,1.0.1,active,"2.16.840.1.113883.4.642.1.1106",ListEmptyReasons,List Empty Reasons,"General reasons for a list to be empty. Reasons are either related to a summary list (i.e. problem or medication list) or to a workflow related list (i.e. consultation list).","ValueSet/list-empty-reason"
http://terminology.hl7.org/CodeSystem/list-order,1.0.1,active,"2.16.840.1.113883.4.642.1.1107",ListOrderCodes,List Order Codes,"Base values for the order of the items in a list resource.","ValueSet/list-order"
http://terminology.hl7.org/CodeSystem/measure-scoring,4.0.0,active,"2.16.840.1.113883.4.642.1.1232",MeasureScoring,Measure Scoring,"The scoring type of the measure.","ValueSet/measure-scoring"
http://terminology.hl7.org/CodeSystem/measure-type,3.0.1,active,"2.16.840.1.113883.4.642.1.1233",MeasureType,MeasureType,"The type of measure (includes codes from 2.16.840.1.113883.1.11.20368).","ValueSet/measure-type"
http://terminology.hl7.org/CodeSystem/medicationknowledge-characteristic,1.0.1,active,"2.16.840.1.113883.4.642.1.1338",MedicationKnowledgeCharacteristicCodes,MedicationKnowledge Characteristic Codes,"MedicationKnowledge Characteristic Codes","ValueSet/medicationknowledge-characteristic"
http://terminology.hl7.org/CodeSystem/medicationrequest-category,1.0.0,draft,"2.16.840.1.113883.4.642.1.1323",MedicationRequestCategoryCodes,MedicationRequest Category Codes,"MedicationRequest Category Codes","ValueSet/medicationrequest-category"
http://terminology.hl7.org/CodeSystem/object-role,1.0.1,active,"2.16.840.1.113883.4.642.1.1135",AuditEventEntityRole,AuditEventEntityRole,"Code representing the role the entity played in the audit event.","ValueSet/object-role"
http://terminology.hl7.org/CodeSystem/observation-category,1.0.1,active,"2.16.840.1.113883.4.642.1.1125",ObservationCategoryCodes,Observation Category Codes,"Observation Category codes.","ValueSet/observation-category"
http://terminology.hl7.org/CodeSystem/payment-type,1.0.1,active,"2.16.840.1.113883.4.642.1.1186",PaymentTypeCodes,Payment Type Codes,"This value set includes sample Payment Type codes.","ValueSet/payment-type"
http://terminology.hl7.org/CodeSystem/referencerange-meaning,1.0.1,active,"2.16.840.1.113883.4.642.1.1124",ObservationReferenceRangeMeaningCodes,Observation Reference Range Meaning Codes,"This value set defines a set of codes that can be used to indicate the meaning/use of a reference range for a particular target population.","ValueSet/referencerange-meaning"
http://terminology.hl7.org/CodeSystem/research-study-objective-type,1.0.0,draft,"2.16.840.1.113883.4.642.1.1248",ResearchStudyObjectiveType,ResearchStudyObjectiveType,"Codes for the kind of study objective.","ValueSet/research-study-objective-type"
http://terminology.hl7.org/CodeSystem/research-study-reason-stopped,1.0.0,draft,"2.16.840.1.113883.4.642.1.1249",ResearchStudyReasonStopped,ResearchStudyReasonStopped,"Codes for why the study ended prematurely.","ValueSet/research-study-reason-stopped"
http://terminology.hl7.org/CodeSystem/research-subject-state,1.0.1,active,"2.16.840.1.113883.4.642.1.0",ResearchSubjectState,ResearchSubjectState,"Indicates the progression of a study subject through a study.","ValueSet/R5-research-subject-state-for-R4"
http://terminology.hl7.org/CodeSystem/state-change-reason,1.0.0,draft,"2.16.840.1.113883.4.642.1.0",StateChangeReason,StateChangeReason,"Indicates why the state of the subject changed.","ValueSet/state-change-reason"
http://terminology.hl7.org/CodeSystem/synthesis-type,2.0.0,active,"2.16.840.1.113883.4.642.1.1348",StatisticSynthesisType,StatisticSynthesisType,"Types of combining results from a body of evidence (eg. summary data meta-analysis).","ValueSet/synthesis-type"
http://terminology.hl7.org/CodeSystem/testscript-operation-codes,1.0.0,draft,"2.16.840.1.113883.4.642.1.1195",TestScriptOperationCode,Test script operation code,"This value set defines a set of codes that are used to indicate the supported operations of a testing engine or tool.","ValueSet/testscript-operation-codes"
http://terminology.hl7.org/CodeSystem/v2-0003,2.13.0,active,"2.16.840.1.113883.18.4",EventType,eventType,"HL7-defined code system of concepts specifying the trigger event for Version 2.x interface messages.  Used in HL7 Version 2.x messaging in the MSH segment.","ValueSet/v2-0003"
http://terminology.hl7.org/CodeSystem/v2-0074,2.0.0,active,"2.16.840.1.113883.18.29",DiagnosticServiceSectionId,diagnosticServiceSectionId,"HL7-defined code system of concepts which specify a section of a diagnostic service where the observation may be performed.  Used in HL7 Version 2.x messaging in the OBR and OM4 segments.","ValueSet/diagnostic-service-sections"
http://terminology.hl7.org/CodeSystem/v2-0276,2.0.0,active,"2.16.840.1.113883.18.169",AppointmentReason,appointmentReason,"Code system of concepts used to describe the kind of appointment or the reason why an appointment has been scheduled.  Used in HL7 Version 2.x messaging in the ARQ segment.","ValueSet/v2-0276"
http://terminology.hl7.org/CodeSystem/v2-0371,2.0.0,active,"2.16.840.1.113883.18.229",AdditivePreservative,additivePreservative,"HL7-defined code system of concepts specifying any additive introduced to the specimen before or at the time of collection.  These additives may be introduced in order to preserve, maintain or enhance the particular nature or component of the specimen.  Used in HL7 Version 2.x messaging in the SPM and SAC segments.","ValueSet/v2-0371"
http://terminology.hl7.org/CodeSystem/v2-0570,2.0.0,active,"2.16.840.1.113883.18.370",PaymentMethod,paymentMethod,"Code system of concepts used to specify the method for the movement of payment.  Used in the Payment Information (PMT) segment in HL7 Version 2.x messaging.","ValueSet/v2-0570"
http://terminology.hl7.org/CodeSystem/v2-0936,2.0.0,active,"2.16.840.1.113883.18.439",ObservationType,observationType,"HL7-defined code system of concepts specifying types of observations to enable systems to distinguish between observations sent along with an order, versus observations sent as the result to an order. Used in HL7 Version 2.x messaging in the OBX segment.","ValueSet/v2-0936"
